IP / UDP 10.210.31.23:netbios_ns > 10.210.255.255:netbios_ns / NBNSQueryRequest
IP / UDP 10.210.31.23:netbios_ns > 10.210.255.255:netbios_ns / NBNSQueryRequest
IP / UDP 10.210.31.23:59243 > 239.255.255.250:1900 / Raw
IP / UDP 10.210.31.23:55947 > 224.0.0.251:mdns / Raw
IP / TCP 10.210.31.23:61440 > 193.235.203.21:https PA / Raw
IP / TCP 193.235.203.21:https > 10.210.31.23:61440 PA / Raw
IP / TCP 10.210.31.23:61440 > 193.235.203.21:https A
IP / TCP 193.235.203.21:https > 10.210.31.23:61440 PA / Raw
IP / TCP 10.210.31.23:61440 > 193.235.203.21:https A
IP / TCP 10.210.31.23:61440 > 193.235.203.21:https A / Raw
IP / TCP 10.210.31.23:61440 > 193.235.203.21:https PA / Raw
IP / TCP 193.235.203.21:https > 10.210.31.23:61440 A
IP / TCP 193.235.203.21:https > 10.210.31.23:61440 PA / Raw
IP / TCP 10.210.31.23:61440 > 193.235.203.21:https A
IP / TCP 10.210.31.23:61440 > 193.235.203.21:https PA / Raw
IP / TCP 193.235.203.21:https > 10.210.31.23:61440 PA / Raw
IP / TCP 10.210.31.23:61440 > 193.235.203.21:https A
IP / TCP 10.210.31.23:61457 > 52.85.107.107:https A / Padding
IP / TCP 52.85.107.107:https > 10.210.31.23:61457 A
IP / TCP 10.210.31.23:61458 > 93.184.215.151:https A / Padding
IP / TCP 93.184.215.151:https > 10.210.31.23:61458 A / Padding
IP / TCP 10.210.31.23:61449 > 172.217.28.36:https A / Padding
IP / TCP 172.217.28.36:https > 10.210.31.23:61449 A
IP / UDP 10.210.31.23:59243 > 239.255.255.250:1900 / Raw
IP / UDP 10.210.31.23:55947 > 224.0.0.251:mdns / Raw
IP / TCP 10.210.31.23:61440 > 193.235.203.21:https PA / Raw
IP / TCP 193.235.203.21:https > 10.210.31.23:61440 PA / Raw
IP / TCP 10.210.31.23:61440 > 193.235.203.21:https A
IP / TCP 10.210.31.23:61438 > 64.233.186.109:imaps PA / Raw
IP / TCP 10.210.31.23:61456 > 64.233.186.108:imaps PA / Raw
IP / TCP 64.233.186.109:imaps > 10.210.31.23:61438 A
IP / TCP 64.233.186.108:imaps > 10.210.31.23:61456 A
IP / TCP 64.233.186.108:imaps > 10.210.31.23:61456 PA / Raw
IP / TCP 64.233.186.108:imaps > 10.210.31.23:61456 PA / Raw
IP / TCP 10.210.31.23:61456 > 64.233.186.108:imaps A
IP / TCP 10.210.31.23:61456 > 64.233.186.108:imaps A
IP / TCP 64.233.186.109:imaps > 10.210.31.23:61438 PA / Raw
IP / TCP 10.210.31.23:61438 > 64.233.186.109:imaps A
IP / TCP 10.210.31.23:61456 > 64.233.186.108:imaps PA / Raw
IP / TCP 10.210.31.23:61438 > 64.233.186.109:imaps PA / Raw
IP / TCP 64.233.186.108:imaps > 10.210.31.23:61456 A
IP / TCP 64.233.186.109:imaps > 10.210.31.23:61438 A
IP / TCP 64.233.186.108:imaps > 10.210.31.23:61456 PA / Raw
IP / TCP 10.210.31.23:61456 > 64.233.186.108:imaps A
IP / TCP 64.233.186.109:imaps > 10.210.31.23:61438 PA / Raw
IP / TCP 10.210.31.23:61438 > 64.233.186.109:imaps A
IP / TCP 10.210.31.23:61438 > 64.233.186.109:imaps PA / Raw
IP / TCP 10.210.31.23:61456 > 64.233.186.108:imaps PA / Raw
IP / TCP 64.233.186.109:imaps > 10.210.31.23:61438 A
IP / TCP 64.233.186.108:imaps > 10.210.31.23:61456 A
IP / TCP 64.233.186.108:imaps > 10.210.31.23:61456 PA / Raw
IP / TCP 10.210.31.23:61456 > 64.233.186.108:imaps A
IP / TCP 64.233.186.108:imaps > 10.210.31.23:61456 PA / Raw
IP / TCP 64.233.186.108:imaps > 10.210.31.23:61456 PA / Raw
IP / TCP 10.210.31.23:61456 > 64.233.186.108:imaps A
IP / TCP 10.210.31.23:61456 > 64.233.186.108:imaps A
IP / TCP 10.210.31.23:61456 > 64.233.186.108:imaps PA / Raw
IP / TCP 10.210.31.23:61456 > 64.233.186.108:imaps A / Raw
IP / TCP 10.210.31.23:61456 > 64.233.186.108:imaps PA / Raw
IP / TCP 64.233.186.108:imaps > 10.210.31.23:61456 A
IP / TCP 64.233.186.108:imaps > 10.210.31.23:61456 A
IP / TCP 64.233.186.108:imaps > 10.210.31.23:61456 A
IP / TCP 10.210.31.23:61456 > 64.233.186.108:imaps PA / Raw
IP / TCP 64.233.186.108:imaps > 10.210.31.23:61456 A
IP / TCP 64.233.186.109:imaps > 10.210.31.23:61438 PA / Raw
IP / TCP 10.210.31.23:61438 > 64.233.186.109:imaps A
IP / TCP 10.210.31.23:61438 > 64.233.186.109:imaps PA / Raw
IP / TCP 64.233.186.109:imaps > 10.210.31.23:61438 A
IP / TCP 64.233.186.108:imaps > 10.210.31.23:61456 PA / Raw
IP / TCP 10.210.31.23:61456 > 64.233.186.108:imaps A
IP / TCP 64.233.186.108:imaps > 10.210.31.23:61456 PA / Raw
IP / TCP 10.210.31.23:61456 > 64.233.186.108:imaps A
IP / TCP 64.233.186.108:imaps > 10.210.31.23:61456 PA / Raw
IP / TCP 10.210.31.23:61456 > 64.233.186.108:imaps A
IP / TCP 64.233.186.108:imaps > 10.210.31.23:61456 PA / Raw
IP / TCP 10.210.31.23:61456 > 64.233.186.108:imaps A
IP / TCP 64.233.186.108:imaps > 10.210.31.23:61456 PA / Raw
IP / TCP 10.210.31.23:61456 > 64.233.186.108:imaps A
IP / TCP 64.233.186.108:imaps > 10.210.31.23:61456 PA / Raw
IP / TCP 10.210.31.23:61456 > 64.233.186.108:imaps A
IP / TCP 64.233.186.108:imaps > 10.210.31.23:61456 PA / Raw
IP / TCP 10.210.31.23:61456 > 64.233.186.108:imaps A
IP / TCP 64.233.186.108:imaps > 10.210.31.23:61456 PA / Raw
IP / TCP 10.210.31.23:61456 > 64.233.186.108:imaps A
IP / TCP 64.233.186.108:imaps > 10.210.31.23:61456 PA / Raw
IP / TCP 10.210.31.23:61456 > 64.233.186.108:imaps A
IP / TCP 64.233.186.108:imaps > 10.210.31.23:61456 PA / Raw
IP / TCP 10.210.31.23:61456 > 64.233.186.108:imaps A
IP / TCP 64.233.186.108:imaps > 10.210.31.23:61456 PA / Raw
IP / TCP 10.210.31.23:61456 > 64.233.186.108:imaps A
IP / TCP 64.233.186.108:imaps > 10.210.31.23:61456 PA / Raw
IP / TCP 10.210.31.23:61456 > 64.233.186.108:imaps A
IP / TCP 64.233.186.108:imaps > 10.210.31.23:61456 PA / Raw
IP / TCP 10.210.31.23:61456 > 64.233.186.108:imaps A
IP / TCP 64.233.186.108:imaps > 10.210.31.23:61456 PA / Raw
IP / TCP 10.210.31.23:61456 > 64.233.186.108:imaps A
IP / TCP 64.233.186.108:imaps > 10.210.31.23:61456 PA / Raw
IP / TCP 10.210.31.23:61456 > 64.233.186.108:imaps A
IP / TCP 64.233.186.108:imaps > 10.210.31.23:61456 PA / Raw
IP / TCP 10.210.31.23:61456 > 64.233.186.108:imaps A
IP / TCP 64.233.186.108:imaps > 10.210.31.23:61456 PA / Raw
IP / TCP 10.210.31.23:61456 > 64.233.186.108:imaps A
IP / TCP 64.233.186.108:imaps > 10.210.31.23:61456 PA / Raw
IP / TCP 10.210.31.23:61456 > 64.233.186.108:imaps A
IP / TCP 64.233.186.108:imaps > 10.210.31.23:61456 PA / Raw
IP / TCP 10.210.31.23:61456 > 64.233.186.108:imaps A
IP / TCP 64.233.186.108:imaps > 10.210.31.23:61456 PA / Raw
IP / TCP 10.210.31.23:61456 > 64.233.186.108:imaps A
IP / TCP 64.233.186.108:imaps > 10.210.31.23:61456 PA / Raw
IP / TCP 10.210.31.23:61456 > 64.233.186.108:imaps A
IP / UDP 10.210.31.23:59243 > 239.255.255.250:1900 / Raw
IP / UDP 10.210.31.23:55947 > 224.0.0.251:mdns / Raw
IP / TCP 64.233.186.109:imaps > 10.210.31.23:61438 PA / Raw
IP / TCP 10.210.31.23:61438 > 64.233.186.109:imaps A
IP / TCP 10.210.31.23:61438 > 64.233.186.109:imaps PA / Raw
IP / TCP 64.233.186.109:imaps > 10.210.31.23:61438 A
IP / TCP 10.210.31.23:61456 > 64.233.186.108:imaps PA / Raw
IP / TCP 64.233.186.108:imaps > 10.210.31.23:61456 A
IP / TCP 64.233.186.108:imaps > 10.210.31.23:61456 PA / Raw
IP / TCP 10.210.31.23:61456 > 64.233.186.108:imaps A
IP / TCP 64.233.186.109:imaps > 10.210.31.23:61438 PA / Raw
IP / TCP 64.233.186.109:imaps > 10.210.31.23:61438 PA / Raw
IP / TCP 10.210.31.23:61438 > 64.233.186.109:imaps A
IP / TCP 10.210.31.23:61438 > 64.233.186.109:imaps A
IP / TCP 64.233.186.109:imaps > 10.210.31.23:61438 PA / Raw
IP / TCP 10.210.31.23:61438 > 64.233.186.109:imaps A
IP / TCP 10.210.31.23:61438 > 64.233.186.109:imaps PA / Raw
IP / TCP 64.233.186.109:imaps > 10.210.31.23:61438 A
IP / TCP 64.233.186.109:imaps > 10.210.31.23:61438 PA / Raw
IP / TCP 10.210.31.23:61438 > 64.233.186.109:imaps A
IP / TCP 10.210.31.23:61438 > 64.233.186.109:imaps PA / Raw
IP / TCP 64.233.186.109:imaps > 10.210.31.23:61438 A
IP / TCP 64.233.186.109:imaps > 10.210.31.23:61438 PA / Raw
IP / TCP 10.210.31.23:61438 > 64.233.186.109:imaps A
IP / TCP 10.210.31.23:61438 > 64.233.186.109:imaps PA / Raw
IP / TCP 64.233.186.109:imaps > 10.210.31.23:61438 A
IP / UDP 10.210.31.23:59243 > 239.255.255.250:1900 / Raw
IP / UDP 10.210.31.23:55947 > 224.0.0.251:mdns / Raw
IP / UDP / DNS Qry "p23-keyvalueservice-current.edge.icloud.apple-dns.net." 
IP / UDP / DNS Ans "17.248.138.17" 
IP / TCP 10.210.31.23:61472 > 17.248.138.17:https S
IP / TCP 17.248.138.17:https > 10.210.31.23:61472 SA
IP / TCP 10.210.31.23:61472 > 17.248.138.17:https A
IP / TCP 10.210.31.23:61472 > 17.248.138.17:https PA / Raw
IP / TCP 17.248.138.17:https > 10.210.31.23:61472 A
IP / TCP 17.248.138.17:https > 10.210.31.23:61472 PA / Raw
IP / TCP 10.210.31.23:61472 > 17.248.138.17:https A
IP / TCP 10.210.31.23:61472 > 17.248.138.17:https A
IP / TCP 10.210.31.23:61472 > 17.248.138.17:https A
IP / TCP 10.210.31.23:61472 > 17.248.138.17:https PA / Raw
IP / TCP 10.210.31.23:61472 > 17.248.138.17:https PA / Raw
IP / TCP 10.210.31.23:61472 > 17.248.138.17:https PA / Raw
IP / TCP 64.233.186.109:imaps > 10.210.31.23:61438 PA / Raw
IP / TCP 10.210.31.23:61438 > 64.233.186.109:imaps A
IP / TCP 64.233.186.109:imaps > 10.210.31.23:61438 PA / Raw
IP / TCP 10.210.31.23:61438 > 64.233.186.109:imaps A
IP / TCP 10.210.31.23:61438 > 64.233.186.109:imaps PA / Raw
IP / TCP 64.233.186.109:imaps > 10.210.31.23:61438 A
IP / TCP 17.248.138.17:https > 10.210.31.23:61472 A
IP / TCP 17.248.138.17:https > 10.210.31.23:61472 PA / Raw
IP / TCP 10.210.31.23:61472 > 17.248.138.17:https A
IP / TCP 10.210.31.23:61472 > 17.248.138.17:https PA / Raw
IP / TCP 10.210.31.23:61472 > 17.248.138.17:https PA / Raw
IP / TCP 17.248.138.17:https > 10.210.31.23:61472 A
IP / TCP 17.248.138.17:https > 10.210.31.23:61472 PA / Raw
IP / TCP 10.210.31.23:61472 > 17.248.138.17:https A
IP / TCP 10.210.31.23:61472 > 17.248.138.17:https FA
IP / TCP 17.248.138.17:https > 10.210.31.23:61472 FA
IP / TCP 10.210.31.23:61472 > 17.248.138.17:https A
IP / TCP 64.233.186.109:imaps > 10.210.31.23:61438 PA / Raw
IP / TCP 10.210.31.23:61438 > 64.233.186.109:imaps A
IP / TCP 64.233.186.109:imaps > 10.210.31.23:61438 PA / Raw
IP / TCP 64.233.186.109:imaps > 10.210.31.23:61438 PA / Raw
IP / TCP 10.210.31.23:61438 > 64.233.186.109:imaps A
IP / TCP 10.210.31.23:61438 > 64.233.186.109:imaps A
IP / TCP 10.210.31.23:61438 > 64.233.186.109:imaps PA / Raw
IP / TCP 64.233.186.109:imaps > 10.210.31.23:61438 A
IP / TCP 64.233.186.109:imaps > 10.210.31.23:61438 PA / Raw
IP / TCP 10.210.31.23:61438 > 64.233.186.109:imaps A
IP / TCP 10.210.31.23:61438 > 64.233.186.109:imaps PA / Raw
IP / TCP 64.233.186.109:imaps > 10.210.31.23:61438 A
ARP who has 10.210.31.23 says 10.210.210.199 / Padding
ARP is at 2c:f0:ee:1e:14:76 says 10.210.31.23 / Padding
IP / TCP 64.233.186.109:imaps > 10.210.31.23:61438 PA / Raw
IP / TCP 10.210.31.23:61438 > 64.233.186.109:imaps A
IP / TCP 64.233.186.109:imaps > 10.210.31.23:61438 PA / Raw
IP / TCP 10.210.31.23:61438 > 64.233.186.109:imaps A
IP / TCP 10.210.31.23:61438 > 64.233.186.109:imaps PA / Raw
IP / TCP 10.210.31.23:61456 > 64.233.186.108:imaps PA / Raw
IP / TCP 64.233.186.109:imaps > 10.210.31.23:61438 A
IP / TCP 64.233.186.108:imaps > 10.210.31.23:61456 A
IP / UDP 157.92.37.105:30217 > 255.255.255.255:5246 / Raw
IP / TCP 64.233.186.108:imaps > 10.210.31.23:61456 PA / Raw
IP / TCP 10.210.31.23:61456 > 64.233.186.108:imaps A
IP / TCP 10.210.31.23:61456 > 64.233.186.108:imaps PA / Raw
IP / TCP 64.233.186.108:imaps > 10.210.31.23:61456 A
IP / TCP 10.210.31.23:61436 > 190.221.162.39:https PA / Raw
IP / TCP 10.210.31.23:61436 > 190.221.162.39:https PA / Raw
IP / TCP 190.221.162.39:https > 10.210.31.23:61436 A
IP / TCP 190.221.162.39:https > 10.210.31.23:61436 A
IP / TCP 190.221.162.39:https > 10.210.31.23:61436 PA / Raw
IP / TCP 10.210.31.23:61436 > 190.221.162.39:https A
IP / TCP 190.221.162.39:https > 10.210.31.23:61436 PA / Raw
IP / TCP 10.210.31.23:61436 > 190.221.162.39:https A
IP / TCP 10.210.31.23:61436 > 190.221.162.39:https PA / Raw
IP / TCP 190.221.162.39:https > 10.210.31.23:61436 A
IP / UDP 10.210.31.23:59243 > 239.255.255.250:1900 / Raw
IP / UDP 10.210.31.23:55947 > 224.0.0.251:mdns / Raw
IP / TCP 64.233.186.109:imaps > 10.210.31.23:61438 PA / Raw
IP / TCP 64.233.186.109:imaps > 10.210.31.23:61438 PA / Raw
IP / TCP 64.233.186.108:imaps > 10.210.31.23:61456 PA / Raw
IP / TCP 64.233.186.108:imaps > 10.210.31.23:61456 PA / Raw
IP / TCP 64.233.186.108:imaps > 10.210.31.23:61456 PA / Raw
IP / TCP 10.210.31.23:61438 > 64.233.186.109:imaps A
IP / TCP 10.210.31.23:61438 > 64.233.186.109:imaps A
IP / TCP 10.210.31.23:61456 > 64.233.186.108:imaps A
IP / TCP 10.210.31.23:61456 > 64.233.186.108:imaps A
IP / TCP 10.210.31.23:61456 > 64.233.186.108:imaps A
IP / TCP 64.233.186.108:imaps > 10.210.31.23:61456 PA / Raw
IP / TCP 10.210.31.23:61456 > 64.233.186.108:imaps A
IP / TCP 10.210.31.23:61456 > 64.233.186.108:imaps PA / Raw
IP / TCP 10.210.31.23:61438 > 64.233.186.109:imaps PA / Raw
IP / TCP 64.233.186.108:imaps > 10.210.31.23:61456 A
IP / TCP 64.233.186.109:imaps > 10.210.31.23:61438 A
IP / TCP 10.210.31.23:61437 > 190.94.187.16:http FA
IP / TCP 190.94.187.16:http > 10.210.31.23:61437 FA
IP / TCP 10.210.31.23:61437 > 190.94.187.16:http A
IP / TCP 64.233.186.109:imaps > 10.210.31.23:61438 PA / Raw
IP / TCP 10.210.31.23:61438 > 64.233.186.109:imaps A
IP / TCP 64.233.186.109:imaps > 10.210.31.23:61438 PA / Raw
IP / TCP 10.210.31.23:61438 > 64.233.186.109:imaps A
IP / TCP 10.210.31.23:61438 > 64.233.186.109:imaps PA / Raw
IP / TCP 64.233.186.109:imaps > 10.210.31.23:61438 A
IP / TCP 64.233.186.108:imaps > 10.210.31.23:61456 PA / Raw
IP / TCP 10.210.31.23:61456 > 64.233.186.108:imaps A
IP / TCP 64.233.186.108:imaps > 10.210.31.23:61456 PA / Raw
IP / TCP 10.210.31.23:61456 > 64.233.186.108:imaps A
IP / TCP 10.210.31.23:61456 > 64.233.186.108:imaps PA / Raw
IP / TCP 64.233.186.108:imaps > 10.210.31.23:61456 A
IP / TCP 64.233.186.109:imaps > 10.210.31.23:61438 PA / Raw
IP / TCP 64.233.186.109:imaps > 10.210.31.23:61438 PA / Raw
IP / TCP 10.210.31.23:61438 > 64.233.186.109:imaps A
IP / TCP 10.210.31.23:61438 > 64.233.186.109:imaps A
IP / TCP 64.233.186.109:imaps > 10.210.31.23:61438 PA / Raw
IP / TCP 10.210.31.23:61438 > 64.233.186.109:imaps A
IP / TCP 10.210.31.23:61438 > 64.233.186.109:imaps PA / Raw
IP / TCP 64.233.186.109:imaps > 10.210.31.23:61438 A
IP / TCP 64.233.186.108:imaps > 10.210.31.23:61456 PA / Raw
IP / TCP 10.210.31.23:61456 > 64.233.186.108:imaps A
IP / TCP 64.233.186.108:imaps > 10.210.31.23:61456 PA / Raw
IP / TCP 64.233.186.108:imaps > 10.210.31.23:61456 PA / Raw
IP / TCP 10.210.31.23:61456 > 64.233.186.108:imaps A
IP / TCP 10.210.31.23:61456 > 64.233.186.108:imaps A
IP / UDP 10.210.31.23:57621 > 10.210.255.255:57621 / Raw
IP / TCP 10.210.31.23:61456 > 64.233.186.108:imaps PA / Raw
IP / TCP 64.233.186.108:imaps > 10.210.31.23:61456 A
IP / TCP 64.233.186.109:imaps > 10.210.31.23:61438 PA / Raw
IP / TCP 10.210.31.23:61438 > 64.233.186.109:imaps A
IP / TCP 10.210.31.23:61438 > 64.233.186.109:imaps PA / Raw
IP / TCP 64.233.186.109:imaps > 10.210.31.23:61438 A
IP / TCP 64.233.186.108:imaps > 10.210.31.23:61456 PA / Raw
IP / TCP 10.210.31.23:61456 > 64.233.186.108:imaps A
IP / TCP 10.210.31.23:61456 > 64.233.186.108:imaps PA / Raw
IP / TCP 64.233.186.108:imaps > 10.210.31.23:61456 A
IP / TCP 64.233.186.109:imaps > 10.210.31.23:61438 PA / Raw
IP / TCP 10.210.31.23:61438 > 64.233.186.109:imaps A
IP / TCP 64.233.186.109:imaps > 10.210.31.23:61438 PA / Raw
IP / TCP 10.210.31.23:61438 > 64.233.186.109:imaps A
IP / TCP 10.210.31.23:61438 > 64.233.186.109:imaps PA / Raw
IP / TCP 64.233.186.109:imaps > 10.210.31.23:61438 A
IP / TCP 64.233.186.108:imaps > 10.210.31.23:61456 PA / Raw
IP / TCP 10.210.31.23:61456 > 64.233.186.108:imaps A
IP / TCP 10.210.31.23:61456 > 64.233.186.108:imaps PA / Raw
IP / TCP 64.233.186.108:imaps > 10.210.31.23:61456 A
IP / TCP 64.233.186.109:imaps > 10.210.31.23:61438 PA / Raw
IP / TCP 10.210.31.23:61438 > 64.233.186.109:imaps A
IP / TCP 10.210.31.23:61438 > 64.233.186.109:imaps PA / Raw
IP / TCP 64.233.186.109:imaps > 10.210.31.23:61438 A
IP / TCP 64.233.186.108:imaps > 10.210.31.23:61456 PA / Raw
IP / TCP 10.210.31.23:61456 > 64.233.186.108:imaps A
IP / TCP 10.210.31.23:61456 > 64.233.186.108:imaps PA / Raw
IP / TCP 64.233.186.108:imaps > 10.210.31.23:61456 A
IP / TCP 64.233.186.109:imaps > 10.210.31.23:61438 PA / Raw
IP / TCP 10.210.31.23:61438 > 64.233.186.109:imaps A
IP / TCP 10.210.31.23:61438 > 64.233.186.109:imaps PA / Raw
IP / TCP 64.233.186.109:imaps > 10.210.31.23:61438 A
IP / TCP 64.233.186.108:imaps > 10.210.31.23:61456 PA / Raw
IP / TCP 10.210.31.23:61456 > 64.233.186.108:imaps A
IP / TCP 64.233.186.109:imaps > 10.210.31.23:61438 PA / Raw
IP / TCP 10.210.31.23:61438 > 64.233.186.109:imaps A
IP / TCP 64.233.186.109:imaps > 10.210.31.23:61438 PA / Raw
IP / TCP 64.233.186.109:imaps > 10.210.31.23:61438 PA / Raw
IP / TCP 10.210.31.23:61438 > 64.233.186.109:imaps A
IP / TCP 10.210.31.23:61438 > 64.233.186.109:imaps A
IP / TCP 10.210.31.23:61438 > 64.233.186.109:imaps PA / Raw
IP / TCP 10.210.31.23:61456 > 64.233.186.108:imaps PA / Raw
IP / TCP 64.233.186.109:imaps > 10.210.31.23:61438 A
IP / TCP 64.233.186.108:imaps > 10.210.31.23:61456 A
IP / TCP 64.233.186.109:imaps > 10.210.31.23:61438 PA / Raw
IP / TCP 64.233.186.108:imaps > 10.210.31.23:61456 PA / Raw
IP / TCP 10.210.31.23:61438 > 64.233.186.109:imaps A
IP / TCP 10.210.31.23:61456 > 64.233.186.108:imaps A
IP / TCP 64.233.186.108:imaps > 10.210.31.23:61456 PA / Raw
IP / TCP 10.210.31.23:61456 > 64.233.186.108:imaps A
IP / TCP 10.210.31.23:61456 > 64.233.186.108:imaps PA / Raw
IP / TCP 64.233.186.108:imaps > 10.210.31.23:61456 PA / Raw
IP / TCP 10.210.31.23:61456 > 64.233.186.108:imaps A
IP / TCP 64.233.186.108:imaps > 10.210.31.23:61456 A
IP / TCP 64.233.186.108:imaps > 10.210.31.23:61456 PA / Raw
IP / TCP 64.233.186.108:imaps > 10.210.31.23:61456 PA / Raw
IP / TCP 64.233.186.108:imaps > 10.210.31.23:61456 PA / Raw
IP / TCP 10.210.31.23:61456 > 64.233.186.108:imaps A
IP / TCP 10.210.31.23:61456 > 64.233.186.108:imaps A
IP / TCP 10.210.31.23:61456 > 64.233.186.108:imaps A
IP / TCP 64.233.186.108:imaps > 10.210.31.23:61456 PA / Raw
IP / TCP 10.210.31.23:61456 > 64.233.186.108:imaps A
IP / TCP 10.210.31.23:61456 > 64.233.186.108:imaps PA / Raw
IP / TCP 64.233.186.108:imaps > 10.210.31.23:61456 A
IP / TCP 64.233.186.108:imaps > 10.210.31.23:61456 PA / Raw
IP / TCP 64.233.186.108:imaps > 10.210.31.23:61456 PA / Raw
IP / TCP 10.210.31.23:61456 > 64.233.186.108:imaps A
IP / TCP 10.210.31.23:61456 > 64.233.186.108:imaps A
IP / TCP 10.210.31.23:61456 > 64.233.186.108:imaps PA / Raw
IP / TCP 64.233.186.108:imaps > 10.210.31.23:61456 PA / Raw
IP / TCP 10.210.31.23:61456 > 64.233.186.108:imaps A
IP / TCP 64.233.186.108:imaps > 10.210.31.23:61456 A
IP / TCP 10.210.31.23:61438 > 64.233.186.109:imaps PA / Raw
IP / TCP 64.233.186.109:imaps > 10.210.31.23:61438 A
IP / TCP 64.233.186.108:imaps > 10.210.31.23:61456 PA / Raw
IP / TCP 10.210.31.23:61456 > 64.233.186.108:imaps A
IP / TCP 10.210.31.23:61456 > 64.233.186.108:imaps PA / Raw
IP / TCP 10.210.31.23:61456 > 64.233.186.108:imaps FA
IP / TCP 64.233.186.108:imaps > 10.210.31.23:61456 A
IP / TCP 10.210.31.23:61456 > 64.233.186.108:imaps FA
IP / TCP 64.233.186.108:imaps > 10.210.31.23:61456 A
IP / TCP 10.210.31.23:61456 > 64.233.186.108:imaps A
IP / TCP 64.233.186.109:imaps > 10.210.31.23:61438 PA / Raw
IP / TCP 10.210.31.23:61438 > 64.233.186.109:imaps A
IP / TCP 64.233.186.109:imaps > 10.210.31.23:61438 PA / Raw
IP / TCP 10.210.31.23:61438 > 64.233.186.109:imaps A
IP / TCP 10.210.31.23:61438 > 64.233.186.109:imaps PA / Raw
IP / TCP 64.233.186.109:imaps > 10.210.31.23:61438 A
IP / TCP 64.233.186.108:imaps > 10.210.31.23:61456 FA
IP / TCP 10.210.31.23:61456 > 64.233.186.108:imaps A
IP / TCP 64.233.186.109:imaps > 10.210.31.23:61438 PA / Raw
IP / TCP 10.210.31.23:61438 > 64.233.186.109:imaps A
IP / TCP 10.210.31.23:61438 > 64.233.186.109:imaps PA / Raw
IP / TCP 64.233.186.109:imaps > 10.210.31.23:61438 A
IP / UDP 10.210.31.23:59243 > 239.255.255.250:1900 / Raw
IP / UDP 10.210.31.23:55947 > 224.0.0.251:mdns / Raw
IP / TCP 64.233.186.109:imaps > 10.210.31.23:61438 PA / Raw
IP / TCP 10.210.31.23:61438 > 64.233.186.109:imaps A
IP / TCP 10.210.31.23:61438 > 64.233.186.109:imaps PA / Raw
IP / TCP 64.233.186.109:imaps > 10.210.31.23:61438 A
IP / TCP 10.210.31.23:61461 > 17.248.138.81:https FA
IP / TCP 10.210.31.23:61459 > 17.248.138.81:https FA
IP / TCP 10.210.31.23:61460 > 190.221.162.45:https A / Padding
IP / TCP 190.221.162.45:https > 10.210.31.23:61460 A
IP / TCP 17.248.138.81:https > 10.210.31.23:61461 FA
IP / TCP 10.210.31.23:61461 > 17.248.138.81:https A
IP / TCP 17.248.138.81:https > 10.210.31.23:61459 FA
IP / TCP 10.210.31.23:61459 > 17.248.138.81:https A
IP / TCP 64.233.186.109:imaps > 10.210.31.23:61438 PA / Raw
IP / TCP 10.210.31.23:61438 > 64.233.186.109:imaps A
IP / TCP 64.233.186.109:imaps > 10.210.31.23:61438 PA / Raw
IP / TCP 10.210.31.23:61438 > 64.233.186.109:imaps A
IP / UDP / DNS Qry "imap.gmail.com." 
IP / UDP / DNS Ans "gmail-imap.l.google.com." 
IP / TCP 10.210.31.23:61473 > 64.233.186.109:imaps S
IP / TCP 10.210.31.23:61438 > 64.233.186.109:imaps PA / Raw
IP / TCP 64.233.186.109:imaps > 10.210.31.23:61473 SA
IP / TCP 10.210.31.23:61473 > 64.233.186.109:imaps A
IP / TCP 64.233.186.109:imaps > 10.210.31.23:61438 A
IP / TCP 10.210.31.23:61473 > 64.233.186.109:imaps PA / Raw
IP / TCP 64.233.186.109:imaps > 10.210.31.23:61473 A
IP / TCP 64.233.186.109:imaps > 10.210.31.23:61473 PA / Raw
IP / TCP 10.210.31.23:61473 > 64.233.186.109:imaps A
IP / TCP 10.210.31.23:61473 > 64.233.186.109:imaps PA / Raw
IP / TCP 64.233.186.109:imaps > 10.210.31.23:61473 A
IP / TCP 10.210.31.23:61473 > 64.233.186.109:imaps PA / Raw
IP / TCP 64.233.186.109:imaps > 10.210.31.23:61473 A
IP / TCP 64.233.186.109:imaps > 10.210.31.23:61438 PA / Raw
IP / TCP 10.210.31.23:61438 > 64.233.186.109:imaps A
IP / TCP 64.233.186.109:imaps > 10.210.31.23:61473 PA / Raw
IP / TCP 10.210.31.23:61473 > 64.233.186.109:imaps A
IP / TCP 10.210.31.23:61473 > 64.233.186.109:imaps PA / Raw
IP / TCP 64.233.186.109:imaps > 10.210.31.23:61473 A
IP / TCP 64.233.186.109:imaps > 10.210.31.23:61473 PA / Raw
IP / TCP 10.210.31.23:61473 > 64.233.186.109:imaps A
IP / TCP 10.210.31.23:61473 > 64.233.186.109:imaps PA / Raw
IP / TCP 10.210.31.23:61473 > 64.233.186.109:imaps PA / Raw
IP / UDP 10.210.31.23:59243 > 239.255.255.250:1900 / Raw
IP / UDP 10.210.31.23:55947 > 224.0.0.251:mdns / Raw
IP / TCP 64.233.186.109:imaps > 10.210.31.23:61473 A
IP / TCP 64.233.186.109:imaps > 10.210.31.23:61473 PA / Raw
IP / TCP 10.210.31.23:61473 > 64.233.186.109:imaps A
IP / TCP 10.210.31.23:61473 > 64.233.186.109:imaps PA / Raw
IP / TCP 64.233.186.109:imaps > 10.210.31.23:61473 A
IP / TCP 10.210.31.23:61448 > 64.233.190.188:5228 S
IP / TCP 64.233.186.109:imaps > 10.210.31.23:61473 PA / Raw
IP / TCP 10.210.31.23:61473 > 64.233.186.109:imaps A
IP / TCP 10.210.31.23:61473 > 64.233.186.109:imaps PA / Raw
IP / TCP 64.233.186.109:imaps > 10.210.31.23:61473 A
IP / TCP 10.210.31.23:61453 > 64.233.190.188:5228 S
IP / TCP 64.233.186.109:imaps > 10.210.31.23:61473 PA / Raw
IP / TCP 10.210.31.23:61473 > 64.233.186.109:imaps A
IP / TCP 10.210.31.23:61473 > 64.233.186.109:imaps PA / Raw
IP / TCP 64.233.186.109:imaps > 10.210.31.23:61473 A
IP / TCP 64.233.186.109:imaps > 10.210.31.23:61473 PA / Raw
IP / TCP 10.210.31.23:61473 > 64.233.186.109:imaps A
IP / TCP 10.210.31.23:61473 > 64.233.186.109:imaps PA / Raw
IP / TCP 64.233.186.109:imaps > 10.210.31.23:61473 A
IP / UDP 10.210.31.23:59243 > 239.255.255.250:1900 / Raw
IP / TCP 64.233.186.109:imaps > 10.210.31.23:61473 PA / Raw
IP / TCP 10.210.31.23:61473 > 64.233.186.109:imaps A
IP / TCP 64.233.186.109:imaps > 10.210.31.23:61473 PA / Raw
IP / TCP 10.210.31.23:61473 > 64.233.186.109:imaps A
IP / TCP 10.210.31.23:61473 > 64.233.186.109:imaps PA / Raw
IP / TCP 64.233.186.109:imaps > 10.210.31.23:61473 A
IP / TCP 10.210.31.23:61438 > 64.233.186.109:imaps PA / Raw
IP / TCP 64.233.186.109:imaps > 10.210.31.23:61438 A
IP / TCP 64.233.186.109:imaps > 10.210.31.23:61473 PA / Raw
IP / TCP 10.210.31.23:61473 > 64.233.186.109:imaps A
IP / TCP 10.210.31.23:61473 > 64.233.186.109:imaps PA / Raw
IP / TCP 10.210.31.23:61473 > 64.233.186.109:imaps FA
IP / TCP 64.233.186.109:imaps > 10.210.31.23:61473 A
IP / TCP 10.210.31.23:61473 > 64.233.186.109:imaps FA
IP / TCP 64.233.186.109:imaps > 10.210.31.23:61473 A
IP / TCP 10.210.31.23:61473 > 64.233.186.109:imaps A
IP / TCP 64.233.186.109:imaps > 10.210.31.23:61438 PA / Raw
IP / TCP 10.210.31.23:61438 > 64.233.186.109:imaps A
IP / TCP 10.210.31.23:61438 > 64.233.186.109:imaps PA / Raw
IP / TCP 64.233.186.109:imaps > 10.210.31.23:61438 A
IP / TCP 64.233.186.109:imaps > 10.210.31.23:61473 FA
IP / TCP 10.210.31.23:61473 > 64.233.186.109:imaps A
IP / TCP 64.233.186.109:imaps > 10.210.31.23:61473 FA
IP / TCP 10.210.31.23:61473 > 64.233.186.109:imaps A
IP / TCP 64.233.186.109:imaps > 10.210.31.23:61438 PA / Raw
IP / TCP 10.210.31.23:61438 > 64.233.186.109:imaps A
IP / TCP 10.210.31.23:61438 > 64.233.186.109:imaps PA / Raw
IP / TCP 10.210.31.23:61474 > 64.233.186.109:imaps S
IP / TCP 64.233.186.109:imaps > 10.210.31.23:61438 A
IP / TCP 64.233.186.109:imaps > 10.210.31.23:61474 SA
IP / TCP 10.210.31.23:61474 > 64.233.186.109:imaps A
IP / TCP 10.210.31.23:61474 > 64.233.186.109:imaps PA / Raw
IP / TCP 64.233.186.109:imaps > 10.210.31.23:61474 A
IP / TCP 64.233.186.109:imaps > 10.210.31.23:61474 PA / Raw
IP / TCP 10.210.31.23:61474 > 64.233.186.109:imaps A
IP / TCP 10.210.31.23:61474 > 64.233.186.109:imaps PA / Raw
IP / TCP 64.233.186.109:imaps > 10.210.31.23:61474 A
IP / TCP 10.210.31.23:61474 > 64.233.186.109:imaps PA / Raw
IP / TCP 64.233.186.109:imaps > 10.210.31.23:61474 A
IP / TCP 64.233.186.109:imaps > 10.210.31.23:61473 PA / Raw
IP / TCP 10.210.31.23:61473 > 64.233.186.109:imaps R / Padding
IP / TCP 64.233.186.109:imaps > 10.210.31.23:61474 PA / Raw
IP / TCP 10.210.31.23:61474 > 64.233.186.109:imaps A
IP / TCP 10.210.31.23:61474 > 64.233.186.109:imaps PA / Raw
IP / TCP 64.233.186.109:imaps > 10.210.31.23:61438 PA / Raw
IP / TCP 10.210.31.23:61438 > 64.233.186.109:imaps A
IP / TCP 64.233.186.109:imaps > 10.210.31.23:61474 A
IP / TCP 64.233.186.109:imaps > 10.210.31.23:61474 PA / Raw
IP / TCP 10.210.31.23:61474 > 64.233.186.109:imaps A
IP / TCP 10.210.31.23:61474 > 64.233.186.109:imaps PA / Raw
IP / TCP 64.233.186.109:imaps > 10.210.31.23:61474 A
IP / TCP 10.210.31.23:61460 > 190.221.162.45:https PA / Raw
IP / TCP 10.210.31.23:61460 > 190.221.162.45:https PA / Raw
IP / TCP 190.221.162.45:https > 10.210.31.23:61460 A
IP / TCP 190.221.162.45:https > 10.210.31.23:61460 A
IP / TCP 190.221.162.45:https > 10.210.31.23:61460 PA / Raw
IP / TCP 10.210.31.23:61460 > 190.221.162.45:https A
IP / TCP 64.233.186.109:imaps > 10.210.31.23:61474 PA / Raw
IP / TCP 10.210.31.23:61474 > 64.233.186.109:imaps A
IP / TCP 10.210.31.23:61474 > 64.233.186.109:imaps PA / Raw
IP / TCP 64.233.186.109:imaps > 10.210.31.23:61474 A
IP / TCP 190.221.162.45:https > 10.210.31.23:61460 PA / Raw
IP / TCP 10.210.31.23:61460 > 190.221.162.45:https A
IP / TCP 190.221.162.45:https > 10.210.31.23:61460 PA / Raw
IP / TCP 10.210.31.23:61460 > 190.221.162.45:https A
IP / TCP 190.221.162.45:https > 10.210.31.23:61460 A / Raw
IP / TCP 190.221.162.45:https > 10.210.31.23:61460 PA / Raw
IP / TCP 10.210.31.23:61460 > 190.221.162.45:https A
IP / TCP 190.221.162.45:https > 10.210.31.23:61460 A / Raw
IP / TCP 190.221.162.45:https > 10.210.31.23:61460 PA / Raw
IP / TCP 190.221.162.45:https > 10.210.31.23:61460 PA / Raw
IP / TCP 190.221.162.45:https > 10.210.31.23:61460 PA / Raw
IP / TCP 10.210.31.23:61460 > 190.221.162.45:https A
IP / TCP 10.210.31.23:61460 > 190.221.162.45:https A
IP / TCP 10.210.31.23:61460 > 190.221.162.45:https A
IP / TCP 190.221.162.45:https > 10.210.31.23:61460 PA / Raw
IP / TCP 10.210.31.23:61460 > 190.221.162.45:https A
IP / TCP 10.210.31.23:61460 > 190.221.162.45:https A
IP / TCP 190.221.162.45:https > 10.210.31.23:61460 A / Raw
IP / TCP 190.221.162.45:https > 10.210.31.23:61460 PA / Raw
IP / TCP 190.221.162.45:https > 10.210.31.23:61460 PA / Raw
IP / TCP 190.221.162.45:https > 10.210.31.23:61460 PA / Raw
IP / TCP 10.210.31.23:61460 > 190.221.162.45:https A
IP / TCP 10.210.31.23:61460 > 190.221.162.45:https A
IP / TCP 10.210.31.23:61460 > 190.221.162.45:https A
IP / TCP 64.233.186.109:imaps > 10.210.31.23:61474 PA / Raw
IP / TCP 10.210.31.23:61474 > 64.233.186.109:imaps A
IP / TCP 10.210.31.23:61474 > 64.233.186.109:imaps PA / Raw
IP / TCP 64.233.186.109:imaps > 10.210.31.23:61474 A
IP / TCP 190.221.162.45:https > 10.210.31.23:61460 PA / Raw
IP / TCP 10.210.31.23:61460 > 190.221.162.45:https A
IP / TCP 190.221.162.45:https > 10.210.31.23:61460 A / Raw
IP / TCP 10.210.31.23:61460 > 190.221.162.45:https A
IP / TCP 190.221.162.45:https > 10.210.31.23:61460 PA / Raw
IP / TCP 190.221.162.45:https > 10.210.31.23:61460 PA / Raw
IP / TCP 190.221.162.45:https > 10.210.31.23:61460 PA / Raw
IP / TCP 10.210.31.23:61460 > 190.221.162.45:https A
IP / TCP 10.210.31.23:61460 > 190.221.162.45:https A
IP / TCP 10.210.31.23:61460 > 190.221.162.45:https A
IP / TCP 10.210.31.23:61460 > 190.221.162.45:https A
IP / TCP 190.221.162.45:https > 10.210.31.23:61460 A / Raw
IP / TCP 190.221.162.45:https > 10.210.31.23:61460 PA / Raw
IP / TCP 10.210.31.23:61460 > 190.221.162.45:https A
IP / TCP 190.221.162.45:https > 10.210.31.23:61460 PA / Raw
IP / TCP 190.221.162.45:https > 10.210.31.23:61460 PA / Raw
IP / TCP 10.210.31.23:61460 > 190.221.162.45:https A
IP / TCP 10.210.31.23:61460 > 190.221.162.45:https A
IP / TCP 190.221.162.45:https > 10.210.31.23:61460 PA / Raw
IP / TCP 10.210.31.23:61460 > 190.221.162.45:https A
IP / TCP 190.221.162.45:https > 10.210.31.23:61460 PA / Raw
IP / TCP 10.210.31.23:61460 > 190.221.162.45:https A
IP / TCP 190.221.162.45:https > 10.210.31.23:61460 PA / Raw
IP / TCP 10.210.31.23:61460 > 190.221.162.45:https A
IP / TCP 190.221.162.45:https > 10.210.31.23:61460 PA / Raw
IP / TCP 10.210.31.23:61460 > 190.221.162.45:https A
IP / TCP 190.221.162.45:https > 10.210.31.23:61460 PA / Raw
IP / TCP 190.221.162.45:https > 10.210.31.23:61460 PA / Raw
IP / TCP 10.210.31.23:61460 > 190.221.162.45:https A
IP / TCP 10.210.31.23:61460 > 190.221.162.45:https A
IP / TCP 190.221.162.45:https > 10.210.31.23:61460 PA / Raw
IP / TCP 10.210.31.23:61460 > 190.221.162.45:https A
IP / TCP 190.221.162.45:https > 10.210.31.23:61460 PA / Raw
IP / TCP 10.210.31.23:61460 > 190.221.162.45:https A
IP / TCP 190.221.162.45:https > 10.210.31.23:61460 PA / Raw
IP / TCP 10.210.31.23:61460 > 190.221.162.45:https A
IP / TCP 10.210.31.23:61460 > 190.221.162.45:https A
IP / TCP 190.221.162.45:https > 10.210.31.23:61460 PA / Raw
IP / TCP 10.210.31.23:61460 > 190.221.162.45:https A
IP / TCP 190.221.162.45:https > 10.210.31.23:61460 PA / Raw
IP / TCP 10.210.31.23:61460 > 190.221.162.45:https A
IP / TCP 190.221.162.45:https > 10.210.31.23:61460 PA / Raw
IP / TCP 10.210.31.23:61460 > 190.221.162.45:https A
IP / TCP 190.221.162.45:https > 10.210.31.23:61460 PA / Raw
IP / TCP 10.210.31.23:61460 > 190.221.162.45:https A
IP / TCP 190.221.162.45:https > 10.210.31.23:61460 PA / Raw
IP / TCP 190.221.162.45:https > 10.210.31.23:61460 PA / Raw
IP / TCP 10.210.31.23:61460 > 190.221.162.45:https A
IP / TCP 10.210.31.23:61460 > 190.221.162.45:https A
IP / TCP 190.221.162.45:https > 10.210.31.23:61460 PA / Raw
IP / TCP 10.210.31.23:61460 > 190.221.162.45:https A
IP / TCP 190.221.162.45:https > 10.210.31.23:61460 PA / Raw
IP / TCP 190.221.162.45:https > 10.210.31.23:61460 PA / Raw
IP / TCP 10.210.31.23:61460 > 190.221.162.45:https A
IP / TCP 10.210.31.23:61460 > 190.221.162.45:https A
IP / TCP 10.210.31.23:61460 > 190.221.162.45:https PA / Raw
IP / TCP 190.221.162.45:https > 10.210.31.23:61460 A
IP / TCP 64.233.186.109:imaps > 10.210.31.23:61474 PA / Raw
IP / TCP 10.210.31.23:61474 > 64.233.186.109:imaps A
IP / TCP 10.210.31.23:61474 > 64.233.186.109:imaps PA / Raw
IP / TCP 64.233.186.109:imaps > 10.210.31.23:61474 A
IP / TCP 64.233.186.109:imaps > 10.210.31.23:61474 PA / Raw
IP / TCP 10.210.31.23:61474 > 64.233.186.109:imaps A
IP / TCP 10.210.31.23:61474 > 64.233.186.109:imaps PA / Raw
IP / TCP 64.233.186.109:imaps > 10.210.31.23:61474 A
IP / TCP 64.233.186.109:imaps > 10.210.31.23:61474 PA / Raw
IP / TCP 64.233.186.109:imaps > 10.210.31.23:61474 PA / Raw
IP / TCP 10.210.31.23:61474 > 64.233.186.109:imaps A
IP / TCP 10.210.31.23:61474 > 64.233.186.109:imaps A
IP / TCP 10.210.31.23:61474 > 64.233.186.109:imaps PA / Raw
IP / TCP 64.233.186.109:imaps > 10.210.31.23:61474 A
IP / TCP 64.233.186.109:imaps > 10.210.31.23:61474 PA / Raw
IP / TCP 10.210.31.23:61474 > 64.233.186.109:imaps A
IP / TCP 10.210.31.23:61474 > 64.233.186.109:imaps PA / Raw
IP / TCP 10.210.31.23:61474 > 64.233.186.109:imaps FA
IP / TCP 64.233.186.109:imaps > 10.210.31.23:61474 A
IP / TCP 10.210.31.23:61474 > 64.233.186.109:imaps FA
IP / TCP 64.233.186.109:imaps > 10.210.31.23:61474 A
IP / TCP 10.210.31.23:61474 > 64.233.186.109:imaps A
IP / TCP 64.233.186.109:imaps > 10.210.31.23:61474 FA
IP / TCP 10.210.31.23:61474 > 64.233.186.109:imaps A
IP / TCP 10.210.31.23:61475 > 64.233.186.109:imaps S
IP / TCP 64.233.186.109:imaps > 10.210.31.23:61475 SA
IP / TCP 10.210.31.23:61475 > 64.233.186.109:imaps A
IP / TCP 10.210.31.23:61475 > 64.233.186.109:imaps PA / Raw
IP / TCP 64.233.186.109:imaps > 10.210.31.23:61475 A
IP / TCP 64.233.186.109:imaps > 10.210.31.23:61475 PA / Raw
IP / TCP 10.210.31.23:61475 > 64.233.186.109:imaps A
IP / TCP 10.210.31.23:61475 > 64.233.186.109:imaps PA / Raw
IP / TCP 64.233.186.109:imaps > 10.210.31.23:61475 A
IP / TCP 10.210.31.23:61475 > 64.233.186.109:imaps PA / Raw
IP / TCP 64.233.186.109:imaps > 10.210.31.23:61475 A
IP / TCP 64.233.186.109:imaps > 10.210.31.23:61475 PA / Raw
IP / TCP 10.210.31.23:61475 > 64.233.186.109:imaps A
IP / TCP 10.210.31.23:61475 > 64.233.186.109:imaps PA / Raw
IP / TCP 10.210.31.23:61475 > 64.233.186.109:imaps PA / Raw
IP / TCP 64.233.186.109:imaps > 10.210.31.23:61475 A
IP / TCP 64.233.186.109:imaps > 10.210.31.23:61475 A
IP / TCP 64.233.186.109:imaps > 10.210.31.23:61475 PA / Raw
IP / TCP 10.210.31.23:61475 > 64.233.186.109:imaps A
IP / TCP 10.210.31.23:61475 > 64.233.186.109:imaps PA / Raw
IP / TCP 64.233.186.109:imaps > 10.210.31.23:61475 A
IP / TCP 64.233.186.109:imaps > 10.210.31.23:61475 PA / Raw
IP / TCP 10.210.31.23:61475 > 64.233.186.109:imaps A
IP / TCP 10.210.31.23:61475 > 64.233.186.109:imaps PA / Raw
IP / TCP 64.233.186.109:imaps > 10.210.31.23:61475 A
IP / TCP 64.233.186.109:imaps > 10.210.31.23:61475 PA / Raw
IP / TCP 10.210.31.23:61475 > 64.233.186.109:imaps A
IP / TCP 10.210.31.23:61475 > 64.233.186.109:imaps PA / Raw
IP / TCP 64.233.186.109:imaps > 10.210.31.23:61475 A
IP / TCP 64.233.186.109:imaps > 10.210.31.23:61475 PA / Raw
IP / TCP 10.210.31.23:61475 > 64.233.186.109:imaps A
IP / TCP 10.210.31.23:61475 > 64.233.186.109:imaps PA / Raw
IP / TCP 64.233.186.109:imaps > 10.210.31.23:61475 A
IP / TCP 64.233.186.109:imaps > 10.210.31.23:61475 PA / Raw
IP / TCP 10.210.31.23:61475 > 64.233.186.109:imaps A
IP / TCP 10.210.31.23:61475 > 64.233.186.109:imaps PA / Raw
IP / TCP 64.233.186.109:imaps > 10.210.31.23:61475 A
IP / TCP 64.233.186.109:imaps > 10.210.31.23:61475 PA / Raw
IP / TCP 10.210.31.23:61475 > 64.233.186.109:imaps A
IP / TCP 10.210.31.23:61475 > 64.233.186.109:imaps A / Raw
IP / TCP 10.210.31.23:61475 > 64.233.186.109:imaps A / Raw
IP / TCP 10.210.31.23:61475 > 64.233.186.109:imaps PA / Raw
IP / TCP 64.233.186.109:imaps > 10.210.31.23:61475 A
IP / TCP 64.233.186.109:imaps > 10.210.31.23:61475 A
IP / TCP 64.233.186.109:imaps > 10.210.31.23:61475 A
IP / TCP 10.210.31.23:61467 > 17.125.246.55:https FA / Padding
IP / TCP 17.125.246.55:https > 10.210.31.23:61467 FA / Padding
IP / TCP 10.210.31.23:61467 > 17.125.246.55:https A / Padding
IP / TCP 64.233.186.109:imaps > 10.210.31.23:61475 PA / Raw
ARP who has 10.210.31.23 says 10.210.210.199 / Padding
ARP is at 2c:f0:ee:1e:14:76 says 10.210.31.23 / Padding
IP / TCP 10.210.31.23:61475 > 64.233.186.109:imaps A
IP / TCP 10.210.31.23:61475 > 64.233.186.109:imaps PA / Raw
IP / TCP 64.233.186.109:imaps > 10.210.31.23:61475 A
IP / TCP 64.233.186.109:imaps > 10.210.31.23:61475 PA / Raw
IP / TCP 10.210.31.23:61475 > 64.233.186.109:imaps A
IP / TCP 10.210.31.23:61475 > 64.233.186.109:imaps PA / Raw
IP / TCP 64.233.186.109:imaps > 10.210.31.23:61475 A
IP / TCP 10.210.31.23:61457 > 52.85.107.107:https A / Padding
IP / TCP 64.233.186.109:imaps > 10.210.31.23:61475 PA / Raw
IP / TCP 10.210.31.23:61475 > 64.233.186.109:imaps A
IP / TCP 52.85.107.107:https > 10.210.31.23:61457 A
IP / UDP 10.210.31.23:57621 > 10.210.255.255:57621 / Raw
IP / TCP 10.210.31.23:61458 > 93.184.215.151:https A / Padding
IP / TCP 93.184.215.151:https > 10.210.31.23:61458 A / Padding
IP / TCP 10.210.31.23:61436 > 190.221.162.39:https PA / Raw
IP / TCP 10.210.31.23:61436 > 190.221.162.39:https PA / Raw
IP / TCP 190.221.162.39:https > 10.210.31.23:61436 A
IP / TCP 190.221.162.39:https > 10.210.31.23:61436 A
IP / TCP 190.221.162.39:https > 10.210.31.23:61436 PA / Raw
IP / TCP 10.210.31.23:61436 > 190.221.162.39:https A
IP / TCP 190.221.162.39:https > 10.210.31.23:61436 PA / Raw
IP / TCP 10.210.31.23:61436 > 190.221.162.39:https A
IP / TCP 10.210.31.23:61436 > 190.221.162.39:https PA / Raw
IP / TCP 190.221.162.39:https > 10.210.31.23:61436 A
IP / TCP 10.210.31.23:61449 > 172.217.28.36:https A / Padding
IP / TCP 172.217.28.36:https > 10.210.31.23:61449 A
IP / TCP 64.233.186.109:imaps > 10.210.31.23:61438 PA / Raw
IP / TCP 10.210.31.23:61438 > 64.233.186.109:imaps A
IP / UDP / DNS Qry "pd-st.itunes.apple.com." 
IP / UDP / DNS Ans "pd-st-cdn.itunes-apple.com.akadns.net." 
IP / TCP 10.210.31.23:61476 > 17.173.66.95:https S
IP / TCP 17.173.66.95:https > 10.210.31.23:61476 SA
IP / TCP 10.210.31.23:61476 > 17.173.66.95:https A / Padding
IP / TCP 10.210.31.23:61476 > 17.173.66.95:https PA / Raw
IP / TCP 17.173.66.95:https > 10.210.31.23:61476 PA / Raw
IP / TCP 10.210.31.23:61476 > 17.173.66.95:https A / Padding
IP / TCP 17.173.66.95:https > 10.210.31.23:61476 PA / Raw
IP / TCP 10.210.31.23:61476 > 17.173.66.95:https A / Padding
IP / TCP 17.173.66.95:https > 10.210.31.23:61476 PA / Raw
IP / TCP 10.210.31.23:61476 > 17.173.66.95:https A / Padding
IP / TCP 17.173.66.95:https > 10.210.31.23:61476 PA / Raw
IP / TCP 10.210.31.23:61476 > 17.173.66.95:https A / Padding
IP / TCP 10.210.31.23:61476 > 17.173.66.95:https A / Padding
IP / TCP 10.210.31.23:61476 > 17.173.66.95:https PA / Raw
IP / TCP 10.210.31.23:61476 > 17.173.66.95:https PA / Raw
IP / TCP 10.210.31.23:61476 > 17.173.66.95:https PA / Raw
IP / TCP 17.173.66.95:https > 10.210.31.23:61476 A / Padding
IP / TCP 17.173.66.95:https > 10.210.31.23:61476 A / Padding
IP / TCP 17.173.66.95:https > 10.210.31.23:61476 A / Padding
IP / TCP 17.173.66.95:https > 10.210.31.23:61476 PA / Raw
IP / TCP 10.210.31.23:61476 > 17.173.66.95:https A / Padding
IP / TCP 10.210.31.23:61476 > 17.173.66.95:https PA / Raw
IP / TCP 17.173.66.95:https > 10.210.31.23:61476 A / Padding
IP / TCP 17.173.66.95:https > 10.210.31.23:61476 PA / Raw
IP / TCP 10.210.31.23:61476 > 17.173.66.95:https A / Padding
IP / TCP 17.173.66.95:https > 10.210.31.23:61476 PA / Raw
IP / TCP 10.210.31.23:61476 > 17.173.66.95:https A / Padding
IP / TCP 10.210.31.23:61440 > 193.235.203.21:https PA / Raw
IP / TCP 193.235.203.21:https > 10.210.31.23:61440 PA / Raw
IP / TCP 10.210.31.23:61440 > 193.235.203.21:https A
IP / TCP 10.210.31.23:61460 > 190.221.162.45:https A / Padding
IP / TCP 190.221.162.45:https > 10.210.31.23:61460 A
IP / TCP 10.210.31.23:61475 > 64.233.186.109:imaps PA / Raw
IP / TCP 64.233.186.109:imaps > 10.210.31.23:61475 A
IP / TCP 64.233.186.109:imaps > 10.210.31.23:61475 PA / Raw
IP / TCP 10.210.31.23:61475 > 64.233.186.109:imaps A
IP / TCP 10.210.31.23:61475 > 64.233.186.109:imaps PA / Raw
IP / TCP 64.233.186.109:imaps > 10.210.31.23:61475 A
IP / TCP 64.233.186.109:imaps > 10.210.31.23:61475 PA / Raw
IP / TCP 10.210.31.23:61475 > 64.233.186.109:imaps A
IP / TCP 10.210.31.23:61475 > 64.233.186.109:imaps A / Raw
IP / TCP 10.210.31.23:61475 > 64.233.186.109:imaps A / Raw
IP / TCP 10.210.31.23:61475 > 64.233.186.109:imaps PA / Raw
IP / TCP 64.233.186.109:imaps > 10.210.31.23:61475 A
